[
  {
    "label_id": "LBL_COLUMBIA_RECORDS_01",
    "label_corporate_name": "Columbia Records Division 1",
    "parent_music_group": "Sony Music Entertainment",
    "foundation_year": 1887,
    "corporate_headquarters_city": "New York",
    "origin_country": "US",
    "commercial_distribution_channel": "Global Physical & Streaming Distribution",
    "riaa_member_standing": true,
    "historical_catalog_size": 2500,
    "current_operational_status": "Active Major Label Imprint"
  },
  {
    "label_id": "LBL_RCA_VICTOR_02",
    "label_corporate_name": "RCA Victor Division 2",
    "parent_music_group": "Sony Music Entertainment",
    "foundation_year": 1901,
    "corporate_headquarters_city": "New York",
    "origin_country": "US",
    "commercial_distribution_channel": "Global Physical & Streaming Distribution",
    "riaa_member_standing": true,
    "historical_catalog_size": 2700,
    "current_operational_status": "Active Major Label Imprint"
  },
  {
    "label_id": "LBL_ATLANTIC_RECORDS_03",
    "label_corporate_name": "Atlantic Records Division 3",
    "parent_music_group": "Warner Music Group",
    "foundation_year": 1947,
    "corporate_headquarters_city": "New York",
    "origin_country": "US",
    "commercial_distribution_channel": "Global Physical & Streaming Distribution",
    "riaa_member_standing": true,
    "historical_catalog_size": 2900,
    "current_operational_status": "Active Major Label Imprint"
  },
  {
    "label_id": "LBL_MOTOWN_RECORDS_04",
    "label_corporate_name": "Motown Records Division 4",
    "parent_music_group": "Universal Music Group",
    "foundation_year": 1959,
    "corporate_headquarters_city": "Detroit",
    "origin_country": "US",
    "commercial_distribution_channel": "Global Physical & Streaming Distribution",
    "riaa_member_standing": true,
    "historical_catalog_size": 3100,
    "current_operational_status": "Active Major Label Imprint"
  },
  {
    "label_id": "LBL_CAPITOL_RECORDS_05",
    "label_corporate_name": "Capitol Records Division 5",
    "parent_music_group": "Universal Music Group",
    "foundation_year": 1942,
    "corporate_headquarters_city": "Los Angeles",
    "origin_country": "US",
    "commercial_distribution_channel": "Global Physical & Streaming Distribution",
    "riaa_member_standing": true,
    "historical_catalog_size": 3300,
    "current_operational_status": "Active Major Label Imprint"
  },
  {
    "label_id": "LBL_EPIC_RECORDS_06",
    "label_corporate_name": "Epic Records Division 6",
    "parent_music_group": "Sony Music Entertainment",
    "foundation_year": 1953,
    "corporate_headquarters_city": "New York",
    "origin_country": "US",
    "commercial_distribution_channel": "Global Physical & Streaming Distribution",
    "riaa_member_standing": true,
    "historical_catalog_size": 3500,
    "current_operational_status": "Active Major Label Imprint"
  },
  {
    "label_id": "LBL_INTERSCOPE_RECORDS_07",
    "label_corporate_name": "Interscope Records Division 7",
    "parent_music_group": "Universal Music Group",
    "foundation_year": 1990,
    "corporate_headquarters_city": "Santa Monica",
    "origin_country": "US",
    "commercial_distribution_channel": "Global Physical & Streaming Distribution",
    "riaa_member_standing": true,
    "historical_catalog_size": 3700,
    "current_operational_status": "Active Major Label Imprint"
  },
  {
    "label_id": "LBL_DEF_JAM_RECORDINGS_08",
    "label_corporate_name": "Def Jam Recordings Division 8",
    "parent_music_group": "Universal Music Group",
    "foundation_year": 1984,
    "corporate_headquarters_city": "New York",
    "origin_country": "US",
    "commercial_distribution_channel": "Global Physical & Streaming Distribution",
    "riaa_member_standing": true,
    "historical_catalog_size": 3900,
    "current_operational_status": "Active Major Label Imprint"
  },
  {
    "label_id": "LBL_BLUE_NOTE_RECORDS_09",
    "label_corporate_name": "Blue Note Records Division 9",
    "parent_music_group": "Universal Music Group",
    "foundation_year": 1939,
    "corporate_headquarters_city": "New York",
    "origin_country": "US",
    "commercial_distribution_channel": "Global Physical & Streaming Distribution",
    "riaa_member_standing": true,
    "historical_catalog_size": 4100,
    "current_operational_status": "Active Major Label Imprint"
  },
  {
    "label_id": "LBL_WARNER_RECORDS_10",
    "label_corporate_name": "Warner Records Division 10",
    "parent_music_group": "Warner Music Group",
    "foundation_year": 1958,
    "corporate_headquarters_city": "Los Angeles",
    "origin_country": "US",
    "commercial_distribution_channel": "Global Physical & Streaming Distribution",
    "riaa_member_standing": true,
    "historical_catalog_size": 4300,
    "current_operational_status": "Active Major Label Imprint"
  },
  {
    "label_id": "LBL_COLUMBIA_RECORDS_11",
    "label_corporate_name": "Columbia Records Division 11",
    "parent_music_group": "Sony Music Entertainment",
    "foundation_year": 1887,
    "corporate_headquarters_city": "New York",
    "origin_country": "US",
    "commercial_distribution_channel": "Global Physical & Streaming Distribution",
    "riaa_member_standing": true,
    "historical_catalog_size": 4500,
    "current_operational_status": "Active Major Label Imprint"
  },
  {
    "label_id": "LBL_RCA_VICTOR_12",
    "label_corporate_name": "RCA Victor Division 12",
    "parent_music_group": "Sony Music Entertainment",
    "foundation_year": 1901,
    "corporate_headquarters_city": "New York",
    "origin_country": "US",
    "commercial_distribution_channel": "Global Physical & Streaming Distribution",
    "riaa_member_standing": true,
    "historical_catalog_size": 4700,
    "current_operational_status": "Active Major Label Imprint"
  },
  {
    "label_id": "LBL_ATLANTIC_RECORDS_13",
    "label_corporate_name": "Atlantic Records Division 13",
    "parent_music_group": "Warner Music Group",
    "foundation_year": 1947,
    "corporate_headquarters_city": "New York",
    "origin_country": "US",
    "commercial_distribution_channel": "Global Physical & Streaming Distribution",
    "riaa_member_standing": true,
    "historical_catalog_size": 4900,
    "current_operational_status": "Active Major Label Imprint"
  },
  {
    "label_id": "LBL_MOTOWN_RECORDS_14",
    "label_corporate_name": "Motown Records Division 14",
    "parent_music_group": "Universal Music Group",
    "foundation_year": 1959,
    "corporate_headquarters_city": "Detroit",
    "origin_country": "US",
    "commercial_distribution_channel": "Global Physical & Streaming Distribution",
    "riaa_member_standing": true,
    "historical_catalog_size": 5100,
    "current_operational_status": "Active Major Label Imprint"
  },
  {
    "label_id": "LBL_CAPITOL_RECORDS_15",
    "label_corporate_name": "Capitol Records Division 15",
    "parent_music_group": "Universal Music Group",
    "foundation_year": 1942,
    "corporate_headquarters_city": "Los Angeles",
    "origin_country": "US",
    "commercial_distribution_channel": "Global Physical & Streaming Distribution",
    "riaa_member_standing": true,
    "historical_catalog_size": 5300,
    "current_operational_status": "Active Major Label Imprint"
  },
  {
    "label_id": "LBL_EPIC_RECORDS_16",
    "label_corporate_name": "Epic Records Division 16",
    "parent_music_group": "Sony Music Entertainment",
    "foundation_year": 1953,
    "corporate_headquarters_city": "New York",
    "origin_country": "US",
    "commercial_distribution_channel": "Global Physical & Streaming Distribution",
    "riaa_member_standing": true,
    "historical_catalog_size": 5500,
    "current_operational_status": "Active Major Label Imprint"
  },
  {
    "label_id": "LBL_INTERSCOPE_RECORDS_17",
    "label_corporate_name": "Interscope Records Division 17",
    "parent_music_group": "Universal Music Group",
    "foundation_year": 1990,
    "corporate_headquarters_city": "Santa Monica",
    "origin_country": "US",
    "commercial_distribution_channel": "Global Physical & Streaming Distribution",
    "riaa_member_standing": true,
    "historical_catalog_size": 5700,
    "current_operational_status": "Active Major Label Imprint"
  },
  {
    "label_id": "LBL_DEF_JAM_RECORDINGS_18",
    "label_corporate_name": "Def Jam Recordings Division 18",
    "parent_music_group": "Universal Music Group",
    "foundation_year": 1984,
    "corporate_headquarters_city": "New York",
    "origin_country": "US",
    "commercial_distribution_channel": "Global Physical & Streaming Distribution",
    "riaa_member_standing": true,
    "historical_catalog_size": 5900,
    "current_operational_status": "Active Major Label Imprint"
  },
  {
    "label_id": "LBL_BLUE_NOTE_RECORDS_19",
    "label_corporate_name": "Blue Note Records Division 19",
    "parent_music_group": "Universal Music Group",
    "foundation_year": 1939,
    "corporate_headquarters_city": "New York",
    "origin_country": "US",
    "commercial_distribution_channel": "Global Physical & Streaming Distribution",
    "riaa_member_standing": true,
    "historical_catalog_size": 6100,
    "current_operational_status": "Active Major Label Imprint"
  },
  {
    "label_id": "LBL_WARNER_RECORDS_20",
    "label_corporate_name": "Warner Records Division 20",
    "parent_music_group": "Warner Music Group",
    "foundation_year": 1958,
    "corporate_headquarters_city": "Los Angeles",
    "origin_country": "US",
    "commercial_distribution_channel": "Global Physical & Streaming Distribution",
    "riaa_member_standing": true,
    "historical_catalog_size": 6300,
    "current_operational_status": "Active Major Label Imprint"
  },
  {
    "label_id": "LBL_COLUMBIA_RECORDS_21",
    "label_corporate_name": "Columbia Records Division 21",
    "parent_music_group": "Sony Music Entertainment",
    "foundation_year": 1887,
    "corporate_headquarters_city": "New York",
    "origin_country": "US",